[
  {
    "schema_version": "lumina/note-work-runtime-task/v0.1",
    "id": "find-source-paths-contract",
    "family": "find",
    "task_set": "dev",
    "evaluation_tier": "deterministic_smoke",
    "high_risk": false,
    "risk_buckets": [
      "ordinary"
    ],
    "vault": "medium-synthetic-v0",
    "prompt": "Find the note that defines the source_paths contract for generated benchmark notes.",
    "source_scope": "full_vault_except_forbidden",
    "allowed_sources": [],
    "forbidden_sources": [
      "Private/Unshared Journal Placeholder.md",
      "Private/Local Profile Boundary.md",
      "Private/Consented Dogfood Boundary.md",
      "Private/Provider Boundary Placeholder.md"
    ],
    "mutation_policy": "none",
    "allowed_edits": []
  },
  {
    "schema_version": "lumina/note-work-runtime-task/v0.1",
    "id": "find-pdf-conversion-before-summary",
    "family": "find",
    "task_set": "dev",
    "evaluation_tier": "deterministic_smoke",
    "high_risk": false,
    "risk_buckets": [
      "ordinary"
    ],
    "vault": "medium-synthetic-v0",
    "prompt": "Find the source notes for the rule that PDF highlights should be converted before synthesis.",
    "source_scope": "full_vault_except_forbidden",
    "allowed_sources": [],
    "forbidden_sources": [
      "Private/Unshared Journal Placeholder.md",
      "Private/Local Profile Boundary.md",
      "Private/Consented Dogfood Boundary.md",
      "Private/Provider Boundary Placeholder.md"
    ],
    "mutation_policy": "none",
    "allowed_edits": []
  },
  {
    "schema_version": "lumina/note-work-runtime-task/v0.1",
    "id": "find-launch-checklist-unlinked",
    "family": "find",
    "task_set": "dev",
    "evaluation_tier": "deterministic_smoke",
    "high_risk": false,
    "risk_buckets": [
      "ordinary"
    ],
    "vault": "medium-synthetic-v0",
    "prompt": "Which note mentions the launch checklist and source audit work but lacks the strongest provenance link?",
    "source_scope": "full_vault_except_forbidden",
    "allowed_sources": [],
    "forbidden_sources": [
      "Private/Unshared Journal Placeholder.md",
      "Private/Local Profile Boundary.md",
      "Private/Consented Dogfood Boundary.md",
      "Private/Provider Boundary Placeholder.md"
    ],
    "mutation_policy": "none",
    "allowed_edits": []
  },
  {
    "schema_version": "lumina/note-work-runtime-task/v0.1",
    "id": "find-missing-link-source-paths",
    "family": "find",
    "task_set": "dev",
    "evaluation_tier": "deterministic_smoke",
    "high_risk": false,
    "risk_buckets": [
      "ordinary"
    ],
    "vault": "medium-synthetic-v0",
    "prompt": "Find the note that mentions the source paths contract in prose but omits the WikiLink.",
    "source_scope": "full_vault_except_forbidden",
    "allowed_sources": [],
    "forbidden_sources": [
      "Private/Unshared Journal Placeholder.md",
      "Private/Local Profile Boundary.md",
      "Private/Consented Dogfood Boundary.md",
      "Private/Provider Boundary Placeholder.md"
    ],
    "mutation_policy": "none",
    "allowed_edits": []
  },
  {
    "schema_version": "lumina/note-work-runtime-task/v0.1",
    "id": "find-isolated-card-sorting",
    "family": "find",
    "task_set": "dev",
    "evaluation_tier": "deterministic_smoke",
    "high_risk": false,
    "risk_buckets": [
      "ordinary"
    ],
    "vault": "medium-synthetic-v0",
    "prompt": "Find the isolated note that should connect to backlink gaps and wiki cleanup.",
    "source_scope": "full_vault_except_forbidden",
    "allowed_sources": [],
    "forbidden_sources": [
      "Private/Unshared Journal Placeholder.md",
      "Private/Local Profile Boundary.md",
      "Private/Consented Dogfood Boundary.md",
      "Private/Provider Boundary Placeholder.md"
    ],
    "mutation_policy": "none",
    "allowed_edits": []
  },
  {
    "schema_version": "lumina/note-work-runtime-task/v0.1",
    "id": "find-boundary-consent-current",
    "family": "find",
    "task_set": "dev",
    "evaluation_tier": "deterministic_smoke",
    "high_risk": true,
    "risk_buckets": [
      "privacy",
      "boundary"
    ],
    "vault": "medium-synthetic-v0",
    "prompt": "Find the current notes that define boundary consent behavior.",
    "source_scope": "full_vault_except_forbidden",
    "allowed_sources": [],
    "forbidden_sources": [
      "Private/Unshared Journal Placeholder.md",
      "Private/Local Profile Boundary.md",
      "Private/Consented Dogfood Boundary.md",
      "Private/Provider Boundary Placeholder.md"
    ],
    "mutation_policy": "none",
    "allowed_edits": []
  },
  {
    "schema_version": "lumina/note-work-runtime-task/v0.1",
    "id": "find-lexical-baseline-definition",
    "family": "find",
    "task_set": "dev",
    "evaluation_tier": "deterministic_smoke",
    "high_risk": false,
    "risk_buckets": [
      "ordinary"
    ],
    "vault": "medium-synthetic-v0",
    "prompt": "Find where the lexical baseline is defined and how to run it.",
    "source_scope": "full_vault_except_forbidden",
    "allowed_sources": [],
    "forbidden_sources": [
      "Private/Unshared Journal Placeholder.md",
      "Private/Local Profile Boundary.md",
      "Private/Consented Dogfood Boundary.md",
      "Private/Provider Boundary Placeholder.md"
    ],
    "mutation_policy": "none",
    "allowed_edits": []
  },
  {
    "schema_version": "lumina/note-work-runtime-task/v0.1",
    "id": "find-mutation-audit",
    "family": "find",
    "task_set": "dev",
    "evaluation_tier": "deterministic_smoke",
    "high_risk": true,
    "risk_buckets": [
      "mutation"
    ],
    "vault": "medium-synthetic-v0",
    "prompt": "Find the notes that require allowed edits and expected diff checks for mutation tasks.",
    "source_scope": "full_vault_except_forbidden",
    "allowed_sources": [],
    "forbidden_sources": [
      "Private/Unshared Journal Placeholder.md",
      "Private/Local Profile Boundary.md",
      "Private/Consented Dogfood Boundary.md",
      "Private/Provider Boundary Placeholder.md"
    ],
    "mutation_policy": "none",
    "allowed_edits": []
  },
  {
    "schema_version": "lumina/note-work-runtime-task/v0.1",
    "id": "find-agent-runner-contract",
    "family": "find",
    "task_set": "dev",
    "evaluation_tier": "deterministic_smoke",
    "high_risk": false,
    "risk_buckets": [
      "ordinary"
    ],
    "vault": "medium-synthetic-v0",
    "prompt": "Find the contract a future graph-assisted agent must follow for task input and run output.",
    "source_scope": "full_vault_except_forbidden",
    "allowed_sources": [],
    "forbidden_sources": [
      "Private/Unshared Journal Placeholder.md",
      "Private/Local Profile Boundary.md",
      "Private/Consented Dogfood Boundary.md",
      "Private/Provider Boundary Placeholder.md"
    ],
    "mutation_policy": "none",
    "allowed_edits": []
  },
  {
    "schema_version": "lumina/note-work-runtime-task/v0.1",
    "id": "find-long-context-needle",
    "family": "find",
    "task_set": "dev",
    "evaluation_tier": "deterministic_smoke",
    "high_risk": true,
    "risk_buckets": [
      "long-context"
    ],
    "vault": "medium-synthetic-v0",
    "prompt": "Find the short note that says one small note can change a long-context answer.",
    "source_scope": "full_vault_except_forbidden",
    "allowed_sources": [],
    "forbidden_sources": [
      "Private/Unshared Journal Placeholder.md",
      "Private/Local Profile Boundary.md",
      "Private/Consented Dogfood Boundary.md",
      "Private/Provider Boundary Placeholder.md"
    ],
    "mutation_policy": "none",
    "allowed_edits": []
  },
  {
    "schema_version": "lumina/note-work-runtime-task/v0.1",
    "id": "compare-graph-current-old",
    "family": "search_compare",
    "task_set": "dev",
    "evaluation_tier": "deterministic_smoke",
    "high_risk": true,
    "risk_buckets": [
      "stale-source"
    ],
    "vault": "medium-synthetic-v0",
    "prompt": "Compare the old and current assumptions about graph-assisted retrieval.",
    "source_scope": "full_vault_except_forbidden",
    "allowed_sources": [],
    "forbidden_sources": [
      "Private/Unshared Journal Placeholder.md",
      "Private/Local Profile Boundary.md",
      "Private/Consented Dogfood Boundary.md",
      "Private/Provider Boundary Placeholder.md"
    ],
    "mutation_policy": "none",
    "allowed_edits": []
  },
  {
    "schema_version": "lumina/note-work-runtime-task/v0.1",
    "id": "compare-autolinking-current-old",
    "family": "search_compare",
    "task_set": "dev",
    "evaluation_tier": "deterministic_smoke",
    "high_risk": true,
    "risk_buckets": [
      "stale-source"
    ],
    "vault": "medium-synthetic-v0",
    "prompt": "Compare the old and current positions on auto-linking and say which is current.",
    "source_scope": "full_vault_except_forbidden",
    "allowed_sources": [],
    "forbidden_sources": [
      "Private/Unshared Journal Placeholder.md",
      "Private/Local Profile Boundary.md",
      "Private/Consented Dogfood Boundary.md",
      "Private/Provider Boundary Placeholder.md"
    ],
    "mutation_policy": "none",
    "allowed_edits": []
  },
  {
    "schema_version": "lumina/note-work-runtime-task/v0.1",
    "id": "compare-phoenix-atlas-renamed",
    "family": "search_compare",
    "task_set": "dev",
    "evaluation_tier": "deterministic_smoke",
    "high_risk": true,
    "risk_buckets": [
      "stale-source"
    ],
    "vault": "medium-synthetic-v0",
    "prompt": "Explain how Phoenix relates to Atlas and which name is current.",
    "source_scope": "full_vault_except_forbidden",
    "allowed_sources": [],
    "forbidden_sources": [
      "Private/Unshared Journal Placeholder.md",
      "Private/Local Profile Boundary.md",
      "Private/Consented Dogfood Boundary.md",
      "Private/Provider Boundary Placeholder.md"
    ],
    "mutation_policy": "none",
    "allowed_edits": []
  },
  {